<?xml version="1.0" encoding ="UTF-8"?>
<!DOCTYPE SCOPE_NOTE SYSTEM "scope_note.dtd">
<SCOPE_NOTE LNG="ga" VERSION="4.5"><RECORD><DESCRIPTEUR_ID>2153</DESCRIPTEUR_ID><HN>Go dtí an 30.6.2009: Oifig Foilseachán Oifigiúil na gComhphobal Eorpach.</HN></RECORD><RECORD><DESCRIPTEUR_ID>256</DESCRIPTEUR_ID><HN>Roimh 1.12.2009: “Cúirt Iniúchóirí na gComhphobal Eorpach”.</HN></RECORD><RECORD><DESCRIPTEUR_ID>2820</DESCRIPTEUR_ID><HN>Stát féinrialaithe de chuid Ríocht na hÍsiltíre.</HN></RECORD><RECORD><DESCRIPTEUR_ID>333</DESCRIPTEUR_ID><HN>Stát féinrialaithe de chuid Ríocht na hÍsiltíre ó 10.10.2010 (Antillí na hÍsiltíre díscaoilte).</HN></RECORD><RECORD><DESCRIPTEUR_ID>4020</DESCRIPTEUR_ID><HN>Από από την έναρξη ισχύος της συνθήκης της Λισαβόνας (01.12.2009) και μετά να χρησιμοποιείται ο όρος «σύσταση (ΕE)».</HN></RECORD><RECORD><DESCRIPTEUR_ID>451885</DESCRIPTEUR_ID><HN>Stát féinrialaithe de chuid Ríocht na hÍsiltíre ó 10.10.2010 (Antillí na hÍsiltíre díscaoilte).</HN></RECORD><RECORD><DESCRIPTEUR_ID>4524</DESCRIPTEUR_ID><SN>Comhshocraíocht maidir le Trádáil Idirnáisiúnta Teicstílí</SN></RECORD><RECORD><DESCRIPTEUR_ID>5087</DESCRIPTEUR_ID><HN>Eagraíocht eacnamaíoch idir-rialtasach (1949-91) arna bunú ag an Aontas Sóivéadach, an Bhulgáir, an tSeicslóvaic, an Ungáir, an Pholainn agus an Rómáin. Le himeacht aimsire, bhí an Albáin (1949-87), Poblacht Dhaonlathach na Gearmáine (1950-90), an Mhongóil (1962), Cúba (1972) agus Vítneam (1978) páirteach ann, chomh maith leis an Iúgslaiv (1964) mar chomhbhall.</HN></RECORD><RECORD><DESCRIPTEUR_ID>5655</DESCRIPTEUR_ID><HN>Comhar polaitiúil agus réigiúnach arna bhunú ag Poblacht na Seicslóvaice, Poblacht na Polainne agus Poblacht na hUngáire i 1991. Tar éis don tSeicslóvaic titim as a chéile i 1993, tá ceithre thír pairteach ann toisc gur baill den chomhar iad an dá thír a d'eascair asti, mar atá Poblacht na Seice agus Poblacht na Slóvaice.</HN></RECORD><RECORD><DESCRIPTEUR_ID>7185</DESCRIPTEUR_ID><HN>Comhaontú saorthrádála a chruthaigh trí thír lár-Eorpacha (an tSeicslóvaic, an Pholainn is an Ungáir) i 1992 a thugann le chéile páirtithe an AE agus tíortha a d'iarr ballraíocht san AE. An 1 Eanáir 2007 is iad seo a leanas baill an ALECE/CEFTA:  an Chróit, Poblacht Iar-Iúgslavach na Macadóine, an tSeirbia, Montainéagró, an Albáin, an Bhoisnia-Heirseagaivéin, an Mholdóiv is an Chosaiv.</HN></RECORD><RECORD><DESCRIPTEUR_ID>7221</DESCRIPTEUR_ID><HN>Deireadh an tsainordaithe: 31.12.2008.</HN></RECORD><RECORD><DESCRIPTEUR_ID>8549</DESCRIPTEUR_ID><SN>Cabhraíonn an CED le hoibrithe a rinneadh iomarcach de dheasca na bpátrún domhanda trádála a bheith ag athrú chun post nua a fháil chomh tapa agus is féidir.</SN></RECORD></SCOPE_NOTE>