<?xml version="1.0" encoding ="UTF-8"?>
<!DOCTYPE SCOPE_NOTE SYSTEM "scope_note.dtd">
<SCOPE_NOTE LNG="mk" VERSION="4.5"><RECORD><DESCRIPTEUR_ID>3171</DESCRIPTEUR_ID><SN>номенклатура на стоки за надворешнотрговска статистика на Заедницата и статистика за трговијата меѓу државите членки</SN></RECORD><RECORD><DESCRIPTEUR_ID>361</DESCRIPTEUR_ID><SN>законско пренесување на правото на одлучување за одредени области од централната власт на пониските локални органи</SN></RECORD><RECORD><DESCRIPTEUR_ID>6151</DESCRIPTEUR_ID><SN>територија на државите членки кои го имаат усвоено еврото како национално платежно средство</SN></RECORD><RECORD><DESCRIPTEUR_ID>744</DESCRIPTEUR_ID><SN>Обновливи или необновливи извори на енергија кои не ја загадуваат животната средина</SN></RECORD><RECORD><DESCRIPTEUR_ID>8479</DESCRIPTEUR_ID><SN>Институциски метод што ги користи механизмите на првиот столб на ЕУ, наспроти меѓувладиниот метод (односно меѓувладината соработка) којашто се користи за другите столбови.</SN></RECORD></SCOPE_NOTE>